{"case_id":"N14","confirmation":{"business_basis":"user-approved fixed synthetic matrix; no individual human signatures","review_method":"AI independent design review","reviewed_contract_sha256":"76cc222b889b7fa246e93a716d0ff935c63765b25b44cdaa94d0ffb70eed9272","task_sha256":"284d7188bf295a64033b663747124e53296d68d015ce0f27fbf97375b52fb4c5"},"contract_sha256":"76cc222b889b7fa246e93a716d0ff935c63765b25b44cdaa94d0ffb70eed9272","evidence":{"method":"independent Decimal and integer long division","review_basis":"provenance.json fixed expectations; reviewed before implementation","source_review":"negative cancellation produces valid zero"},"expected":{"bindings":[{"fields":["amount"],"file_id":"data","header_row":1,"rows":[2,3],"sheet":"@csv","source":"chosen"}],"reason":null,"status":"VALUE","unit":"units","value":"0"},"manifest_sha256":"5f8bdb5a78e892ecb3ab30f3ba0e4b3a2dab0879e5c18ab6baf1fc37890896dc","origin":"preset_independent"}