{"case_id":"S09","confirmation":{"business_basis":"user-approved fixed synthetic matrix; no individual human signatures","review_method":"AI independent design review","reviewed_contract_sha256":"910772270bcfdaa60420b983f909f60565904232ebc63fe4f94b2b259f2d74cd","task_sha256":"e1f4d6cc9643bfef6cfcf3349cfeb5fee1a74546c225317bef5d5912777bb0bb"},"contract_sha256":"910772270bcfdaa60420b983f909f60565904232ebc63fe4f94b2b259f2d74cd","evidence":{"method":"independent Decimal and integer long division","review_basis":"provenance.json fixed expectations; reviewed before implementation","source_review":"distractor-only revenue_total120->400; revenue unchanged"},"expected":{"bindings":[{"fields":["revenue"],"file_id":"book","header_row":1,"rows":[2,2],"sheet":"Actual","source":"chosen"}],"reason":null,"status":"VALUE","unit":"units","value":"120"},"manifest_sha256":"9dd116d55e25ea971bfa51b03e73cd4bedf815dc5533a06a47e90b93c5380b61","origin":"preset_independent"}