{"case_id":"B21","confirmation":{"business_basis":"user-approved fixed synthetic matrix; no individual human signatures","review_method":"AI independent design review","reviewed_contract_sha256":"76cc222b889b7fa246e93a716d0ff935c63765b25b44cdaa94d0ffb70eed9272","task_sha256":"284d7188bf295a64033b663747124e53296d68d015ce0f27fbf97375b52fb4c5"},"contract_sha256":"76cc222b889b7fa246e93a716d0ff935c63765b25b44cdaa94d0ffb70eed9272","evidence":{"method":"independent Decimal and integer long division","review_basis":"provenance.json fixed expectations; reviewed before implementation","source_review":"B20 columns exchanged with data; exact header rule unchanged; manifest hash updated"},"expected":{"bindings":[{"fields":["amount"],"file_id":"data","header_row":1,"rows":[2,3],"sheet":"@csv","source":"chosen"}],"reason":null,"status":"VALUE","unit":"units","value":"30"},"manifest_sha256":"06aea319a51aca62c10d8dede11bdd37864a1720d8c95e560e0941035fcdae02","origin":"preset_independent"}