{"case_id":"B20","confirmation":{"business_basis":"user-approved fixed synthetic matrix; no individual human signatures","review_method":"AI independent design review","reviewed_contract_sha256":"76cc222b889b7fa246e93a716d0ff935c63765b25b44cdaa94d0ffb70eed9272","task_sha256":"284d7188bf295a64033b663747124e53296d68d015ce0f27fbf97375b52fb4c5"},"contract_sha256":"76cc222b889b7fa246e93a716d0ff935c63765b25b44cdaa94d0ffb70eed9272","evidence":{"method":"independent Decimal and integer long division","review_basis":"provenance.json fixed expectations; reviewed before implementation","source_review":"exact amount=[10,20]; amount_total=[999,999] is distractor"},"expected":{"bindings":[{"fields":["amount"],"file_id":"data","header_row":1,"rows":[2,3],"sheet":"@csv","source":"chosen"}],"reason":null,"status":"VALUE","unit":"units","value":"30"},"manifest_sha256":"eb7a44555b6b00879b86a766c6ba1b3f7e054fe322fa5061bf0b0ad12f95c56d","origin":"preset_independent"}