{"case_id":"N16","confirmation":{"business_basis":"user-approved fixed synthetic matrix; no individual human signatures","review_method":"AI independent design review","reviewed_contract_sha256":"8391f26a6cdeb1bea323c2ecef3931cd0c256de74ae68d7875baf1bae4daa3a0","task_sha256":"e4a869c04a52e1a6c23349eaba8ec7c36721b916bbd1ae7cbe8d7fa33d24721e"},"contract_sha256":"8391f26a6cdeb1bea323c2ecef3931cd0c256de74ae68d7875baf1bae4daa3a0","evidence":{"method":"independent Decimal and integer long division","review_basis":"provenance.json fixed expectations; reviewed before implementation","source_review":"source/field/filter validated; exact eq selects no rows"},"expected":{"bindings":[{"fields":["amount","status"],"file_id":"data","header_row":1,"rows":[2,3],"sheet":"@csv","source":"chosen"}],"reason":null,"status":"VALUE","unit":"units","value":"0"},"manifest_sha256":"cbeb573d4d1ecbb04467f2f9c7e6d2dfb596041ee9a0815cc3cc7fb52df540a2","origin":"preset_independent"}