{"case_id":"U27","confirmation":{"business_basis":"user-approved fixed synthetic matrix; no individual human signatures","review_method":"AI independent design review","reviewed_contract_sha256":"6d390d1078b2903d910439daa7094a8c88a31aecdb6062941269812f5d3a9283","task_sha256":"0137490eef75b5b27c615fd9c36d5e94b782b1009859b1f67877ab01c9081f98"},"contract_sha256":"6d390d1078b2903d910439daa7094a8c88a31aecdb6062941269812f5d3a9283","evidence":{"method":"independent Decimal and integer long division","review_basis":"provenance.json fixed expectations; reviewed before implementation","source_review":"explicit source and output CNY; no inference"},"expected":{"bindings":[{"fields":["amount"],"file_id":"data","header_row":1,"rows":[2,3],"sheet":"@csv","source":"chosen"}],"reason":null,"status":"VALUE","unit":"CNY","value":"30"},"manifest_sha256":"166258795e90c93578dc869da8df44f419328031f42c62c99a618ae9f61f3707","origin":"preset_independent"}