{"case_id":"R24","confirmation":{"business_basis":"user-approved fixed synthetic matrix; no individual human signatures","review_method":"AI independent design review","reviewed_contract_sha256":"019492181877e036a66f940887ad566e1562cdd684b557cc532c872409658181","task_sha256":"2a75fdbedf45b17a547ce2093fbfe5b3429c405f2ef4472b36439c8a320eae08"},"contract_sha256":"019492181877e036a66f940887ad566e1562cdd684b557cc532c872409658181","evidence":{"method":"independent Decimal and integer long division","review_basis":"provenance.json fixed expectations; reviewed before implementation","source_review":"completed=[YES,YES,YES,NO]; included=[YES,YES,YES,YES]; each has own single-field eq"},"expected":{"bindings":[{"fields":["included"],"file_id":"data","header_row":1,"rows":[2,5],"sheet":"@csv","source":"bottom"},{"fields":["completed"],"file_id":"data","header_row":1,"rows":[2,5],"sheet":"@csv","source":"top"}],"reason":null,"status":"VALUE","unit":"ratio","value":"0.7500"},"manifest_sha256":"803696f444209b25c4727980c3548f038e925043d982e8714e17425b4475ba56","origin":"preset_independent"}