{"case_id":"U29","confirmation":{"business_basis":"user-approved fixed synthetic matrix; no individual human signatures","review_method":"AI independent design review","reviewed_contract_sha256":"f012bacc1080ac2240df5c4366a42889888cec725c078721f3d64b48b4af2fee","task_sha256":"4fb3c1019cba92090c425a573563684cfe9fc3296be4681e6c1a451a17461680"},"contract_sha256":"f012bacc1080ac2240df5c4366a42889888cec725c078721f3d64b48b4af2fee","evidence":{"method":"independent Decimal and integer long division","review_basis":"provenance.json fixed expectations; reviewed before implementation","source_review":"unequal declared labels; no conversion in v0.1"},"expected":{"bindings":[{"fields":["denominator"],"file_id":"data","header_row":1,"rows":[2,2],"sheet":"@csv","source":"bottom"},{"fields":["numerator"],"file_id":"data","header_row":1,"rows":[2,2],"sheet":"@csv","source":"top"}],"reason":"UNSUPPORTED_UNIT_CONVERSION","status":"ABSTAIN","unit":null,"value":null},"manifest_sha256":"6b73c28b0172c5f0df2fb7f69ca8bf89bad8fe5ecb33314b01886fa1ed598d39","origin":"preset_independent"}