{"case_id":"U30","confirmation":{"business_basis":"user-approved fixed synthetic matrix; no individual human signatures","review_method":"AI independent design review","reviewed_contract_sha256":"36df36181145c327a16d52166a373788776fa9a25f6533e5813a639b7a724da8","task_sha256":"e420fe4a668a2e5c3e54717bde5ada179fb7ccd5004324cc313b961f0c1dbc12"},"contract_sha256":"36df36181145c327a16d52166a373788776fa9a25f6533e5813a639b7a724da8","evidence":{"method":"independent Decimal and integer long division","review_basis":"provenance.json fixed expectations; reviewed before implementation","source_review":"different declared currency labels; no conversion in v0.1"},"expected":{"bindings":[{"fields":["denominator"],"file_id":"data","header_row":1,"rows":[2,2],"sheet":"@csv","source":"bottom"},{"fields":["numerator"],"file_id":"data","header_row":1,"rows":[2,2],"sheet":"@csv","source":"top"}],"reason":"UNSUPPORTED_UNIT_CONVERSION","status":"ABSTAIN","unit":null,"value":null},"manifest_sha256":"f4967f172af21d337f744d7db423baaf0693c1879b98e5d66b2526bd0e11bed0","origin":"preset_independent"}