{"case_id":"R23","confirmation":{"business_basis":"user-approved fixed synthetic matrix; no individual human signatures","review_method":"AI independent design review","reviewed_contract_sha256":"7b972d2ef734f47666d542a55451a5a192d23687728cafe314361266bdb35229","task_sha256":"29b290c7fe848ad58c06079a11279d908001ce6379a998c1dfe341ceb3bbc1a2"},"contract_sha256":"7b972d2ef734f47666d542a55451a5a192d23687728cafe314361266bdb35229","evidence":{"method":"independent Decimal and integer long division","review_basis":"provenance.json fixed expectations; reviewed before implementation","source_review":"ratio of totals=91/110; not mean of row ratios=0.5000"},"expected":{"bindings":[{"fields":["denominator"],"file_id":"data","header_row":1,"rows":[2,3],"sheet":"@csv","source":"bottom"},{"fields":["numerator"],"file_id":"data","header_row":1,"rows":[2,3],"sheet":"@csv","source":"top"}],"reason":null,"status":"VALUE","unit":"ratio","value":"0.8273"},"manifest_sha256":"4b255bdf1b3d1ecc882b79ebc48ac562ef0355c977046cc04bf48954d9549c1e","origin":"preset_independent"}