{"case_id":"R26","confirmation":{"business_basis":"user-approved fixed synthetic matrix; no individual human signatures","review_method":"AI independent design review","reviewed_contract_sha256":"2c9b7b348e99afeac433cd4228042c21c336661107f59cb8eab30a359eea929d","task_sha256":"75c1a70dcaf32882ce4822bc22c7cff66630f26295007877e85238518c0319ff"},"contract_sha256":"2c9b7b348e99afeac433cd4228042c21c336661107f59cb8eab30a359eea929d","evidence":{"method":"independent Decimal and integer long division","review_basis":"provenance.json fixed expectations; reviewed before implementation","source_review":"no NaN/Infinity or fabricated zero"},"expected":{"bindings":[{"fields":["denominator"],"file_id":"data","header_row":1,"rows":[2,2],"sheet":"@csv","source":"bottom"},{"fields":["numerator"],"file_id":"data","header_row":1,"rows":[2,2],"sheet":"@csv","source":"top"}],"reason":"ZERO_DENOMINATOR","status":"ABSTAIN","unit":null,"value":null},"manifest_sha256":"852f8e9211d37db2cd6a1015520f1bfa6ed8c1b55f6c7a5f972bc3c9a49c251e","origin":"preset_independent"}