{"case_id":"N18","confirmation":{"business_basis":"user-approved fixed synthetic matrix; no individual human signatures","review_method":"AI independent design review","reviewed_contract_sha256":"2c9b7b348e99afeac433cd4228042c21c336661107f59cb8eab30a359eea929d","task_sha256":"75c1a70dcaf32882ce4822bc22c7cff66630f26295007877e85238518c0319ff"},"contract_sha256":"2c9b7b348e99afeac433cd4228042c21c336661107f59cb8eab30a359eea929d","evidence":{"method":"independent Decimal and integer long division","review_basis":"provenance.json fixed expectations; reviewed before implementation","source_review":"final HALF_UP, no intermediate rounding"},"expected":{"bindings":[{"fields":["denominator"],"file_id":"data","header_row":1,"rows":[2,2],"sheet":"@csv","source":"bottom"},{"fields":["numerator"],"file_id":"data","header_row":1,"rows":[2,2],"sheet":"@csv","source":"top"}],"reason":null,"status":"VALUE","unit":"ratio","value":"0.0313"},"manifest_sha256":"d3bca7b88e3809e0bdae11738b0c01619ba2bc4b105510ad1a076ad26ee8c3db","origin":"preset_independent"}