{"case_id":"U28","confirmation":{"business_basis":"user-approved fixed synthetic matrix; no individual human signatures","review_method":"AI independent design review","reviewed_contract_sha256":"384ba94b6567d9bc39778ee2ed95aa326e1a4857cef373da0a7ffa8e1dcdcb15","task_sha256":"b6af7015a85c8a7f1ce0038649f7f92649d57beb9bee2c7a3b37f96c160cf701"},"contract_sha256":"384ba94b6567d9bc39778ee2ed95aa326e1a4857cef373da0a7ffa8e1dcdcb15","evidence":{"method":"independent Decimal and integer long division","review_basis":"provenance.json fixed expectations; reviewed before implementation","source_review":"JSON ratio value 0.5000; HTML may display50%"},"expected":{"bindings":[{"fields":["denominator"],"file_id":"data","header_row":1,"rows":[2,2],"sheet":"@csv","source":"bottom"},{"fields":["numerator"],"file_id":"data","header_row":1,"rows":[2,2],"sheet":"@csv","source":"top"}],"reason":null,"status":"VALUE","unit":"ratio","value":"0.5000"},"manifest_sha256":"dd90be215a4213cba60762e789a40f0a179c65bd0cb1440b70466392c4563cd3","origin":"preset_independent"}