{"case_id":"B22","confirmation":{"business_basis":"user-approved fixed synthetic matrix; no individual human signatures","review_method":"AI independent design review","reviewed_contract_sha256":"76cc222b889b7fa246e93a716d0ff935c63765b25b44cdaa94d0ffb70eed9272","task_sha256":"284d7188bf295a64033b663747124e53296d68d015ce0f27fbf97375b52fb4c5"},"contract_sha256":"76cc222b889b7fa246e93a716d0ff935c63765b25b44cdaa94d0ffb70eed9272","evidence":{"method":"independent Decimal and integer long division","review_basis":"provenance.json fixed expectations; reviewed before implementation","source_review":"missing exact header, not missing file and not empty selection"},"expected":{"bindings":[{"fields":["amount"],"file_id":"data","header_row":1,"rows":[2,3],"sheet":"@csv","source":"chosen"}],"reason":"MISSING_FIELD","status":"ABSTAIN","unit":null,"value":null},"manifest_sha256":"2377c15165864e138402c455c6e899f213a72edf03ad2656ed282aa1d94c0e5f","origin":"preset_independent"}