{"case_id":"S05","confirmation":{"business_basis":"user-approved fixed synthetic matrix; no individual human signatures","review_method":"AI independent design review","reviewed_contract_sha256":"13854333cc538599116669be7b0e20a43778e9c043ec107cda3003546301f77c","task_sha256":"0bf5f2e9cc79e2d289bcab15d9ad4e67e3bb93f3a94a153fed3b912d20c2ab0a"},"contract_sha256":"13854333cc538599116669be7b0e20a43778e9c043ec107cda3003546301f77c","evidence":{"method":"independent Decimal and integer long division","review_basis":"provenance.json fixed expectations; reviewed before implementation","source_review":"target-only Actual60->80; Forecast unchanged"},"expected":{"bindings":[{"fields":["amount"],"file_id":"book","header_row":1,"rows":[2,3],"sheet":"Actual","source":"chosen"}],"reason":null,"status":"VALUE","unit":"units","value":"120"},"manifest_sha256":"3eda34ad6df0111d2978d55d86fd8793e1268fe5640d3dfbf2e341aba2e84407","origin":"preset_independent"}