{"case_id":"S02","confirmation":{"business_basis":"user-approved fixed synthetic matrix; no individual human signatures","review_method":"AI independent design review","reviewed_contract_sha256":"b7b7ce62e522171f84566082d9e7e74d57c28af9bc38130baced2489772a8880","task_sha256":"ca5c76089cf49533da585d74d4e4d2cda1b73a1b3a8f5bfa22a43ab409cead88"},"contract_sha256":"b7b7ce62e522171f84566082d9e7e74d57c28af9bc38130baced2489772a8880","evidence":{"method":"independent Decimal and integer long division","review_basis":"provenance.json fixed expectations; reviewed before implementation","source_review":"target-only 100->137; other.xlsx stays100"},"expected":{"bindings":[{"fields":["amount"],"file_id":"target","header_row":1,"rows":[2,2],"sheet":"Actual","source":"chosen"}],"reason":null,"status":"VALUE","unit":"units","value":"137"},"manifest_sha256":"ed2f6bd6302eade6578c6e7166a7a668e472e6796bca56cf7a8f303104977d1f","origin":"preset_independent"}