{"case_id":"S01","confirmation":{"business_basis":"user-approved fixed synthetic matrix; no individual human signatures","review_method":"AI independent design review","reviewed_contract_sha256":"b7b7ce62e522171f84566082d9e7e74d57c28af9bc38130baced2489772a8880","task_sha256":"ca5c76089cf49533da585d74d4e4d2cda1b73a1b3a8f5bfa22a43ab409cead88"},"contract_sha256":"b7b7ce62e522171f84566082d9e7e74d57c28af9bc38130baced2489772a8880","evidence":{"method":"independent Decimal and integer long division","review_basis":"provenance.json fixed expectations; reviewed before implementation","source_review":"target.xlsx/Actual/amount=100; other.xlsx=100; base"},"expected":{"bindings":[{"fields":["amount"],"file_id":"target","header_row":1,"rows":[2,2],"sheet":"Actual","source":"chosen"}],"reason":null,"status":"VALUE","unit":"units","value":"100"},"manifest_sha256":"7e6a0a8a52058b1c17b8678d041bbebcd4490d790992334e83f2c480a041efc2","origin":"preset_independent"}