{"case_id":"S11","confirmation":{"business_basis":"user-approved fixed synthetic matrix; no individual human signatures","review_method":"AI independent design review","reviewed_contract_sha256":"729351faa1a6bbe5c438c4c5ec9cfc2912c219b36c64c5d79ad1c9c03bd8e835","task_sha256":"ac859c35157ebc84c5266377d7e576fffd6b216ba47c6b72dc00957c3d6678e0"},"contract_sha256":"729351faa1a6bbe5c438c4c5ec9cfc2912c219b36c64c5d79ad1c9c03bd8e835","evidence":{"method":"independent Decimal and integer long division","review_basis":"provenance.json fixed expectations; reviewed before implementation","source_review":"target-only actual_status row3 OK->OFF"},"expected":{"bindings":[{"fields":["actual_status"],"file_id":"book","header_row":1,"rows":[2,3],"sheet":"Actual","source":"chosen"}],"reason":null,"status":"VALUE","unit":"count","value":"1"},"manifest_sha256":"94d5b5c365db333812bc56d3c735356e671850ab22b218c7b8495a423b49e52a","origin":"preset_independent"}